{
  "schema_version": 2,
  "description": "Tracks every installed Vintage Story mod, plus the originals of forks we keep an eye on (installed:false). Structure defined in MOD_DB.schema.json. Dated action history (updates, decisions taken) belongs in AgentLogs/, not here.",
  "mods": [
    {
      "modid": "aculinaryartillery",
      "name": "A Culinary Artillery",
      "installed": true,
      "assetid": 4151,
      "url": "https://mods.vintagestory.at/aculinaryartillery",
      "version": "2.0.0-dev.27",
      "author": "l33tmaan",
      "checked": [
        {
          "version": "2.0.0-dev.27",
          "date": "2026-10-12",
          "downloads": 792048,
          "note": "Updated from dev.24 together with the rest of the Expanded Foods family (user decision 2026-10-12). dev.25 fixes the dev.24 meathook InvalidCastException ('Fix crash caused by direct cast from IDictionary', 'Fix duplicate meathook transforms'); dev.25 also reworked meat racks/bottle racks into fewer block variants, dev.26 fixed handbook crashes, dev.27 fixed rack Z-fighting and mixing-recipe satiety. Known on dev.27 (mod-page comments 2026-10-11/12): (1) breaks Hydrate or Diedrate hydration via the new liquid heal-over-time patch, fix awaiting review; HoD is not installed here, so it does not apply; (2) one report that meat on hooks / bottles in racks are invisible but still interactable (cosmetic). Recheck for dev.28."
        },
        {
          "version": "2.0.0-dev.24",
          "date": "2026-09-20",
          "downloads": 763769,
          "note": "Known bug, no fix released yet (dev.24 is still the latest, published 2026-09-16): dev.24's new custom meathook shapes/transforms make BlockEntityMeatHooks.getOrCreateMesh throw InvalidCastException (TextureDictionary -> Dictionary<string, CompositeTexture>). Seen locally as a logged (non-fatal) tesselation error on a meat hook at 515802/111/511071 (that hook probably renders wrong), and reported on the mod page by another user as a hard crash when putting a small copper cauldron on a hook. Not the cause of the ProtoException-on-load crashes (2026-09-17/18/20). Recheck for dev.25; avoid hanging cauldrons/saucepans on meat hooks meanwhile. Staying on dev.24 for now: rolling back to dev.23 would avoid the meathook shapes but is untested against the current world."
        },
        {
          "version": "2.0.0-dev.23",
          "date": "2026-09-07",
          "downloads": 745883,
          "note": "Bugfix release: trader prices +25% (reflects ability to deconstruct bottle racks/cauldrons), egg yolk text fix in stew, bottle rack recipe no longer conflicts with gates, egg liquids get pie mixing codes, fixed crash creating cached meal recipe stacks with no handbook stacks, corked bottles can no longer be drunk from directly, oak bark usable for vanilla tannins."
        },
        {
          "version": "2.0.0-dev.22",
          "date": "2026-09-01",
          "downloads": 737913,
          "known_incompatibilities": "none found; ships its own compat patches for Wildcraft Trees, Material Needs, More Animals",
          "note": "Library/dependency, historically split off from Expanded Foods."
        }
      ]
    },
    {
      "modid": "alchemy",
      "name": "Alchemy",
      "installed": true,
      "assetid": 487,
      "url": "https://mods.vintagestory.at/alchemy",
      "version": "2.1.24",
      "author": "llama3013",
      "checked": [
        {
          "version": "2.1.24",
          "date": "2026-10-12",
          "downloads": 540257,
          "note": "Still on the stable 2.1.x line (2.1.23 player-size hotfix, 2.1.24 Floral Zones compat, potion bases no longer usable as fuel). The 2.2.0 RC track is at rc.12, which needs Effectlib 1.1.1 and wipes active effects/coatings once on upgrade. Keeping the 2026-09-17 decision to stay stable until 2.2.0 is released."
        },
        {
          "version": "2.1.22",
          "date": "2026-09-17",
          "note": "Newest release is 2.2.0-rc.11 (release candidate), migrating potion coating/projectile effects onto a new required dependency mod, Effectlib (~1k downloads, new/small install base). User decision: stay on stable 2.1.22 for now rather than move to the RC track; recheck once 2.2.0 leaves release-candidate status."
        },
        {
          "version": "2.1.22",
          "date": "2026-09-03",
          "downloads": 508102,
          "known_incompatibilities": "incompatible with \"Simple Alchemy\" (not installed) per the mod's own page. No other conflicts documented.",
          "note": "Three-tier potion brewing (mortar & pestle -> brewing cauldron -> glass stirring spoon/herb-dried ingredients) for player buffs — combat, gathering, mobility, and utility effects (water breathing, recall/teleport, growth/shrink, creative-only flight). Potions can be drunk, thrown as splash, or used as weapon coatings. No freshness/perishability mechanic and not classified as food, so no interaction with FoodShelves (installed) at all. Has its own compatibility patch for A Culinary Artillery (installed): lets potions be drunk straight from ACA's glass bottles when 'drink from any container' is enabled in config. Extremely actively maintained (hundreds of config values; this version released the same day as this check). Targets 1.22.0-1.22.7, exact match for game 1.22.7."
        }
      ]
    },
    {
      "modid": "anvilperformanceoptimization",
      "name": "Anvil Performance Optimization",
      "installed": true,
      "assetid": 50265,
      "url": "https://mods.vintagestory.at/show/mod/50265",
      "version": "1.0.0",
      "author": "illustrious18",
      "checked": [
        {
          "version": "1.0.0",
          "date": "2026-09-01",
          "downloads": 12403,
          "note": "Prewarms the vanilla anvil interaction-help cache (fixes a cache miss in BlockAnvil.GetPlacedBlockInteractionHelp()) to stop the freeze on first viewing an anvil. Patches a vanilla engine bug, not another mod — no patch_for target. Release page only tags game 1.22.0-1.22.2 and hasn't updated since May 2026, but modinfo.json only requires game >=1.22.0 with no upper cap; installed anyway on game 1.22.7 per user decision (paired with smithingplusbugfix on the same author's recommendation). One comment reported a 1.22.3 crash but it was traced to a server-connect timeout, not this mod. Revisit if the underlying vanilla bug ever gets fixed upstream by the game itself."
        }
      ]
    },
    {
      "modid": "egocaribautomapmarkers",
      "name": "Auto Map Markers",
      "installed": true,
      "assetid": 797,
      "url": "https://mods.vintagestory.at/automapmarkers",
      "version": "5.0.3",
      "author": "egocarib",
      "checked": [
        {
          "version": "5.0.3",
          "date": "2026-09-01",
          "downloads": 309388,
          "known_incompatibilities": "none found; ships its own compat patches for other mods' markers"
        }
      ]
    },
    {
      "modid": "bedspawnv2",
      "name": "BedSpawn",
      "installed": true,
      "assetid": 13060,
      "url": "https://mods.vintagestory.at/bedspawn",
      "version": "1.7.1",
      "author": "ilan",
      "checked": [
        {
          "version": "1.7.1",
          "date": "2026-09-01",
          "downloads": 303732
        }
      ]
    },
    {
      "modid": "betterruins",
      "name": "BetterRuins",
      "installed": true,
      "assetid": 3829,
      "url": "https://mods.vintagestory.at/betterruins",
      "version": "0.6.4",
      "author": "NiclAss",
      "checked": [
        {
          "version": "0.6.4",
          "date": "2026-10-12",
          "downloads": 1193826,
          "note": "Updated to 0.6.4 for testing (user decision 2026-10-12). New content only appears in chunks generated after the update. The page's RiverGen chunk-border warning does not apply: it says Rivers (installed) already has the fix. Possible conflict: one mod-page report (2026-10-02) of a dedicated server deadlocking during chunk loading ('chunkdbthread' not suspended) on 0.6.4; the reporter later confirmed Farseer (installed here) was the cause. The author does not know of the bug. If the game hangs while loading chunks, roll back to 0.6.3 or disable Farseer."
        },
        {
          "version": "0.6.3",
          "date": "2026-09-01",
          "downloads": 1130991,
          "known_incompatibilities": "RiverGen used alongside BetterRuins updates on an existing world risks terrain glitches/cliff chunk borders (upstream \"Rivers Mod\" has a fix, RiverGen does not) — only relevant if RiverGen is ever installed. Confirmed compatible with FieldsAndPlateaus, PlainsAndValleys (installed), Vanilla_PlusWorldGen, Worldgenfix(remix), Conquest Landform Overhaul, TerraPrety."
        }
      ]
    },
    {
      "modid": "bettertraders",
      "name": "BetterTraders",
      "installed": true,
      "assetid": 6160,
      "url": "https://mods.vintagestory.at/bettertraders",
      "version": "0.2.1",
      "author": "NiclAss",
      "checked": [
        {
          "version": "0.2.1",
          "date": "2026-09-01",
          "downloads": 213856,
          "known_incompatibilities": "none found; has optional compat content for Bricklayers and Expanded Foods (installed)",
          "note": "Server-side only."
        }
      ]
    },
    {
      "modid": "bloodtrail",
      "name": "BloodTrail",
      "installed": true,
      "assetid": 30331,
      "url": "https://mods.vintagestory.at/bloodtrail",
      "version": "1.2.11",
      "author": "Aylor",
      "checked": [
        {
          "version": "1.2.5",
          "date": "2026-09-01",
          "downloads": 289033,
          "known_incompatibilities": "none found; maintains compat patches for 20+ animal mods"
        }
      ]
    },
    {
      "modid": "boatautopilot",
      "name": "Boat Autopilot",
      "installed": true,
      "assetid": 59733,
      "url": "https://mods.vintagestory.at/show/mod/59733",